{
  "schemaVersion": "1.2",
  "layout": {
    "tiers": ["External", "Services"],
    "routing": { "channels": { "gapIn": 0.5 } },
    "page": { "heightIn": 8.5, "marginIn": 0.5, "paginate": false }
  },
  "nodes": [
    { "id": "E1", "label": "E1", "tier": "External" },
    { "id": "E2", "label": "E2", "tier": "External" },
    { "id": "S1", "label": "S1", "tier": "Services" },
    { "id": "S2", "label": "S2", "tier": "Services" }
  ],
  "edges": [
    { "sourceId": "E1", "targetId": "S2" },
    { "sourceId": "E2", "targetId": "S1" }
  ]
}

